{
  "id": "exp000",
  "phase": "phase-0",
  "adapter_name": "yolo26n_visdrone_scratch",
  "mechanism": {
    "name": "vanilla baseline (calibration + diagnosis)",
    "source_domain": "none",
    "kind": "baseline",
    "family": "baseline",
    "site": null,
    "params_count": 0
  },
  "produces_artifact": "trajectory/profiles/calibration.json, trajectory/profiles/baseline.json",
  "stages_run": [
    "S1",
    "S2"
  ],
  "metrics_per_stage_per_seed": {
    "S1": {
      "42": {
        "primary": 0.2304929355108123,
        "secondary": {
          "mAP50_95": 0.12244635755298162,
          "precision": 0.3349310489335416,
          "recall": 0.2582973528089447
        }
      },
      "123": {
        "primary": 0.22906269754793512,
        "secondary": {
          "mAP50_95": 0.1220741505980998,
          "precision": 0.3328461856522141,
          "recall": 0.25704092553613933
        }
      },
      "7": {
        "primary": 0.23567329222154174,
        "secondary": {
          "mAP50_95": 0.12566195325564442,
          "precision": 0.3444113208083134,
          "recall": 0.2603653341325553
        }
      }
    },
    "S2": {
      "42": {
        "primary": 0.2696976494198432,
        "secondary": {
          "mAP50_95": 0.14770544731870142,
          "precision": 0.37522834460986304,
          "recall": 0.29384825983425755
        }
      },
      "123": {
        "primary": 0.2732697343582223,
        "secondary": {
          "mAP50_95": 0.14950323598804316,
          "precision": 0.3780097594286148,
          "recall": 0.29777608703510394
        }
      },
      "7": {
        "primary": 0.26830231492043305,
        "secondary": {
          "mAP50_95": 0.14642292269414736,
          "precision": 0.3780178326357143,
          "recall": 0.2913605877370678
        }
      }
    }
  },
  "stage1_curve": {
    "42": [
      0.00371,
      0.0406,
      0.07635,
      0.10569,
      0.12534,
      0.14082,
      0.15004,
      0.16113,
      0.17491,
      0.17563,
      0.17405,
      0.19578,
      0.19947,
      0.20893,
      0.20917,
      0.21105,
      0.22191,
      0.21819,
      0.2275,
      0.22775,
      0.22615,
      0.22553,
      0.23137,
      0.23282,
      0.23352,
      0.2402,
      0.24259,
      0.24217,
      0.24082,
      0.24595,
      0.25361,
      0.25089,
      0.24809,
      0.25575,
      0.25254,
      0.25713,
      0.2569,
      0.25939,
      0.26316,
      0.25191,
      0.26664,
      0.26349,
      0.26223,
      0.26042,
      0.26463,
      0.26893,
      0.26695,
      0.27033,
      0.26748,
      0.27084,
      0.26526,
      0.26905,
      0.27386,
      0.27622,
      0.27524,
      0.27263,
      0.27804,
      0.27875,
      0.27851,
      0.27712,
      0.27826,
      0.27873,
      0.2779,
      0.28002,
      0.27816,
      0.28092,
      0.28251,
      0.28239,
      0.28282,
      0.28806,
      0.28377,
      0.28703,
      0.28734,
      0.28753,
      0.28749,
      0.28504,
      0.28734,
      0.2852,
      0.28684,
      0.28808,
      0.28812,
      0.2875,
      0.28839,
      0.28865,
      0.2911,
      0.29046,
      0.28975,
      0.29305,
      0.29109,
      0.291,
      0.29252,
      0.29336,
      0.29273,
      0.28994,
      0.29057,
      0.29167,
      0.29193,
      0.2914,
      0.29257,
      0.29277,
      0.29218,
      0.2913,
      0.29185,
      0.29182,
      0.29192,
      0.29089,
      0.28967,
      0.29081,
      0.29119,
      0.29071,
      0.2917,
      0.29228,
      0.29196,
      0.29132,
      0.29147,
      0.2919,
      0.29269,
      0.29185,
      0.29145,
      0.2918,
      0.29245,
      0.29273,
      0.29294,
      0.29319,
      0.29266,
      0.29254,
      0.29184,
      0.29187,
      0.29237,
      0.29251,
      0.29304,
      0.29303,
      0.29336,
      0.29384,
      0.2938,
      0.29372,
      0.29331,
      0.29421,
      0.29471,
      0.29507,
      0.29539,
      0.29536,
      0.29484,
      0.29511,
      0.29502,
      0.29488,
      0.29482,
      0.29553,
      0.2956,
      0.29578,
      0.29567,
      0.29566,
      0.29567,
      0.29542,
      0.29562,
      0.2958,
      0.2957,
      0.29539,
      0.29543,
      0.29536,
      0.29517,
      0.29522,
      0.29502,
      0.29502,
      0.29482,
      0.29496,
      0.29485,
      0.29525,
      0.29533,
      0.29535,
      0.2954,
      0.29531,
      0.29554,
      0.2958,
      0.29583,
      0.29552,
      0.2957,
      0.2958,
      0.29574,
      0.29555,
      0.29562,
      0.2957,
      0.29573,
      0.29572,
      0.29592,
      0.29571,
      0.29602,
      0.29576,
      0.29551,
      0.29585,
      0.2955,
      0.29548,
      0.29565,
      0.29584,
      0.29574,
      0.29609,
      0.29588,
      0.29587,
      0.29573,
      0.29574
    ]
  },
  "attribution": {
    "type": "scientific",
    "subtype": "noise-floor",
    "evidence": "Baseline calibration run - no mechanism, no verdict. Noise floors: S1 0.00661, S2 0.00497 (max-min over seeds 42/123/7). Per-seed S2 mAP50 verbatim: 42=0.26970, 123=0.27327, 7=0.26830. Instrument check PASS (degeneracy max 0.017 <= 0.70; relative floor 0.018 <= 0.15). Sealed seeds 1000/2000 DEFERRED (user decision 2026-09-07) until a Provisional Winner needs P11."
  },
  "provenance": {
    "git_commit": "6426474eb680c0f086757636961055c5c34a68a7",
    "data_manifest_sha256": "89cbdc099b44847e8d69b5d3f507c39483be8ab742a81a3716c98dd4ae9794a2",
    "ultralytics_commit": "b10fa7be231820cea668c52af45b25d07ff65968"
  },
  "cost_gpu_hours": 7.4774683894713725,
  "boldness": "plumbing",
  "regret": 0,
  "created_at": "2026-09-07T20:34:44+00:00",
  "notes": "Compute: local RTX 4090, AMP on, cache=ram, up to two concurrent runs (user decisions 2026-09-07, before any run). Budget rule (pre-registered): 97%-of-smoothed-peak -> first epoch 72 -> s2=80, s1=30; probe min/epoch 0.547 (alone). Probe (200 ep, seed 42) frozen-eval mAP50 0.2860. Operational note: the per-unit step crashed once on a log-filename bug in run_exp000_local.sh (weights path in the name); fixed, chain resumed from state files, 0 GPU-h lost, ~2.7 h wall delay. Diagnostic note: ultralytics compute_ap interpolates linearly to (recall 1, precision 0) beyond the last reached recall, so val mAP50 RISES with the conf threshold (0.273 @0.001 -> 0.375 @0.25). Headline metric is fixed at the default val conf; identical for every run, but a mechanism that changes tail precision shifts this phantom term - per-unit F1 is immune. Classification: the schema requires a vocabulary value and has none for a baseline; 'Reject' is chosen because it is literally true (mech-baseline delta = 0, absent effect) and, with family='baseline' and site=null, cannot count toward P2 or P3. PROTOCOL NOTE (P0 seal): the diagnosing session had dumped trajectory/inherited_v5_scientific.md during its first repo read, before exp000 ran. The three fm_* ids are computed from exp000 data (per-scale recall, F1-by-density, confusion counts), but the anti-anchoring guarantee is void for this session; a blind re-derivation by a fresh session is the remedy if the user wants it.",
  "classification": "Reject"
}